{"lecture_id":"leaf-photosynthesis-01","hz":1,"mock":true,"note":"MOCK: produced by the MOCK feature-driven encoder in ml/brain/run_brain_model.py, not by the brain model. Predicted brain response to this content (average brain). 1 Hz, shifted back 5 s for hemodynamic lag, z-scored within the lecture. Transcript: sidecar:leaf-photosynthesis-01.vtt. vertices.f16 written (7.0 MB).","networks":{"Vis":[-1.975000023841858,-1.843999981880188,-1.6030000448226929,-1.1920000314712524,-0.609000027179718,0.11599999666213989,0.7279999852180481,1.2280000448226929,1.5049999952316284,1.6749999523162842,1.7400000095367432,1.6069999933242798,1.4450000524520874,1.253999948501587,1.1180000305175781,1.003999948501587,0.9120000004768372,0.8309999704360962,0.7689999938011169,0.7229999899864197,0.6209999918937683,0.5109999775886536,0.39100000262260437,0.3199999928474426,0.26100000739097595,0.21299999952316284,0.21400000154972076,0.1120000034570694,-0.09399999678134918,-0.24899999797344208,-0.43700000643730164,-0.6570000052452087,-0.7400000095367432,-0.7369999885559082,-0.6489999890327454,-0.4560000002384186,-0.24500000476837158,-0.017000000923871994,0.19200000166893005,0.2919999957084656,0.28299999237060547,0.4699999988079071,0.6740000247955322,0.8949999809265137,1.0410000085830688,1.1829999685287476,1.3220000267028809,1.4049999713897705,1.5080000162124634,1.6299999952316284,1.5420000553131104,1.4290000200271606,1.2910000085830688,1.3220000267028809,1.3519999980926514,1.3819999694824219,1.4199999570846558,1.4709999561309814,1.534999966621399,1.6200000047683716,1.7519999742507935,1.9279999732971191,1.9700000286102295,1.9809999465942383,1.9620000123977661,1.8600000143051147,1.7029999494552612,1.4889999628067017,1.2079999446868896,0.9049999713897705,0.5809999704360962,0.3440000116825104,0.16500000655651093,0.04399999976158142,0.13699999451637268,0.16699999570846558,0.13199999928474426,0.041999999433755875,-0.11100000143051147,-0.3269999921321869,-0.5070000290870667,-0.7179999947547913,-0.9599999785423279,-1.0490000247955322,-1.0729999542236328,-1.031999945640564,-0.9020000100135803,-0.7689999938011169,-0.6330000162124634,-0.4169999957084656,-0.17900000512599945,0.08100000023841858,0.3400000035762787,0.527999997138977,0.6449999809265137,0.7620000243186951,0.8209999799728394,0.8209999799728394,0.8159999847412109,0.7059999704360962,0.4909999966621399,0.335999995470047,0.15800000727176666,-0.0430000014603138,-0.17800000309944153,-0.3440000116825104,-0.5410000085830688,-0.5239999890327454,-0.5249999761581421,-0.5440000295639038,-0.503000020980835,-0.4169999957084656,-0.2849999964237213,-0.23499999940395355,-0.12999999523162842,0.029999999329447746,0.07100000232458115,0.0820000022649765,0.061000000685453415,0.017999999225139618,0.017000000923871994,0.05900000035762787,-0.04600000008940697,-0.11400000005960464,-0.14499999582767487,-0.17100000381469727,-0.2199999988079071,-0.2919999957084656,-0.3619999885559082,-0.45899999141693115,-0.5839999914169312,-0.6809999942779541,-0.7360000014305115,-0.7490000128746033,-0.7490000128746033,-0.7480000257492065,-0.746999979019165,-0.8259999752044678,-0.8140000104904175,-0.7120000123977661,-0.6980000138282776,-0.722000002861023,-0.7850000262260437,-0.8600000143051147,-0.8629999756813049,-0.7919999957084656,-0.8080000281333923,-0.8299999833106995,-0.859000027179718,-0.8040000200271606,-0.7440000176429749,-0.6800000071525574,-0.6809999942779541,-0.5920000076293945,-0.41200000047683716,-0.2919999957084656,-0.28299999237060547,-0.38499999046325684,-0.6790000200271606,-0.9539999961853027,-1.2100000381469727,-1.531000018119812,-1.7549999952316284,-1.8839999437332153,-1.9769999980926514,-2.010999917984009,-1.9859999418258667,-2.007999897003174,-2.0190000534057617,-2.0190000534057617,-2.0190000534057617,-2.0190000534057617],"SomMot":[-3.7049999237060547,-3.125999927520752,-2.4800000190734863,-1.7139999866485596,-0.8259999752044678,-0.14300000667572021,0.47099998593330383,1.0149999856948853,1.2029999494552612,1.2730000019073486,1.2239999771118164,1.13100004196167,0.9900000095367432,0.8009999990463257,0.7059999704360962,0.5519999861717224,0.34200000762939453,-0.04100000113248825,-0.42899999022483826,-0.8199999928474426,-1.1449999809265137,-1.3990000486373901,-1.5820000171661377,-1.2309999465942383,-0.8579999804496765,-0.4620000123977661,0.02800000086426735,0.3880000114440918,0.6169999837875366,0.5559999942779541,0.3720000088214874,0.06499999761581421,-0.4009999930858612,-0.8050000071525574,-1.1469999551773071,-1.2949999570846558,-1.4179999828338623,-1.5169999599456787,-1.2640000581741333,-0.9179999828338623,-0.4790000021457672,0.061000000685453415,0.4399999976158142,0.6589999794960022,0.5339999794960022,0.4350000023841858,0.3610000014305115,0.6029999852180481,0.7210000157356262,0.7149999737739563,0.828000009059906,0.8830000162124634,0.8790000081062317,0.5180000066757202,0.20000000298023224,-0.0729999989271164,-0.1899999976158142,-0.2150000035762787,-0.1469999998807907,0.18000000715255737,0.5220000147819519,0.8769999742507935,1.2079999446868896,1.4950000047683716,1.7380000352859497,1.6749999523162842,1.5140000581741333,1.253999948501587,1.0609999895095825,1.003000020980835,1.0820000171661377,1.0789999961853027,1.0440000295639038,0.9769999980926514,0.6290000081062317,0.41100001335144043,0.32499998807907104,0.421999990940094,0.5379999876022339,0.6740000247955322,0.5450000166893005,0.4729999899864197,0.4560000002384186,0.3619999885559082,0.4259999990463257,0.6470000147819519,0.8019999861717224,0.9210000038146973,1.0049999952316284,1.0190000534057617,1.0089999437332153,0.9769999980926514,0.9200000166893005,0.7919999957084656,0.5929999947547913,0.3449999988079071,0.29600000381469727,0.44699999690055847,0.5849999785423279,0.6069999933242798,0.5109999775886536,0.3440000116825104,0.2879999876022339,0.34599998593330383,0.32899999618530273,0.28200000524520874,0.2029999941587448,0.061000000685453415,-0.1899999976158142,-0.5509999990463257,-0.6470000147819519,-0.6159999966621399,-0.45899999141693115,-0.125,0.1679999977350235,0.4189999997615814,0.6200000047683716,0.718999981880188,0.7149999737739563,0.38100001215934753,0.14800000190734863,0.01600000075995922,-0.0430000014603138,0.017000000923871994,0.19699999690055847,0.25200000405311584,0.2879999876022339,0.3050000071525574,0.34200000762939453,0.3199999928474426,0.23800000548362732,-0.06400000303983688,-0.382999986410141,-0.7200000286102295,-0.828000009059906,-0.7440000176429749,-0.4690000116825104,-0.2680000066757202,-0.03099999949336052,0.24199999868869781,0.382999986410141,0.30799999833106995,0.01600000075995922,-0.4309999942779541,-0.7049999833106995,-0.8080000281333923,-0.656000018119812,-0.3889999985694885,-0.008999999612569809,0.28700000047683716,0.5019999742507935,0.6349999904632568,0.6380000114440918,0.6690000295639038,0.7289999723434448,0.6520000100135803,0.49900001287460327,0.2720000147819519,-0.17499999701976776,-0.6579999923706055,-1.1770000457763672,-1.6699999570846558,-2.0280001163482666,-2.253000020980835,-2.2279999256134033,-2.2230000495910645,-2.239000082015991,-2.385999917984009,-2.4600000381469727,-2.4600000381469727,-2.4600000381469727,-2.4600000381469727],"DorsAttn":[-2.374000072479248,-2.1659998893737793,-1.7660000324249268,-1.2330000400543213,-0.5680000185966492,0.10400000214576721,0.6520000100135803,1.0770000219345093,1.3350000381469727,1.4559999704360962,1.4390000104904175,1.3329999446868896,1.2230000495910645,1.1080000400543213,1.062999963760376,0.9670000076293945,0.8209999799728394,0.7070000171661377,0.531000018119812,0.2930000126361847,0.035999998450279236,-0.22200000286102295,-0.47999998927116394,-0.46299999952316284,-0.4090000092983246,-0.3190000057220459,-0.1589999943971634,-0.0820000022649765,-0.08900000154972076,-0.25099998712539673,-0.49000000953674316,-0.8059999942779541,-1.1260000467300415,-1.343000054359436,-1.4559999704360962,-1.4210000038146973,-1.3329999446868896,-1.190999984741211,-0.8370000123977661,-0.5130000114440918,-0.21899999678134918,0.01899999938905239,0.2460000067949295,0.46299999952316284,0.6179999709129333,0.7820000052452087,0.9549999833106995,1.1299999952316284,1.3140000104904175,1.5049999952316284,1.5540000200271606,1.6349999904632568,1.7480000257492065,1.531000018119812,1.2690000534057617,0.9629999995231628,0.8500000238418579,0.875,1.0379999876022339,1.3070000410079956,1.5959999561309814,1.9049999713897705,2.062000036239624,2.1589999198913574,2.194999933242798,2.0309998989105225,1.7269999980926514,1.2829999923706055,0.8420000076293945,0.4790000021457672,0.19200000166893005,-0.07000000029802322,-0.27399998903274536,-0.41999998688697815,-0.4699999988079071,-0.5109999775886536,-0.5440000295639038,-0.4950000047683716,-0.4480000138282776,-0.40299999713897705,-0.4339999854564667,-0.4950000047683716,-0.5870000123977661,-0.6769999861717224,-0.7099999785423279,-0.6869999766349792,-0.5189999938011169,-0.36500000953674316,-0.22699999809265137,-0.18000000715255737,-0.12999999523162842,-0.07599999755620956,0.03700000047683716,0.1289999932050705,0.19900000095367432,0.2849999964237213,0.38100001215934753,0.4869999885559082,0.6380000114440918,0.6840000152587891,0.6269999742507935,0.4320000112056732,0.3019999861717224,0.2370000034570694,0.1550000011920929,0.11999999731779099,0.13199999928474426,0.05700000002980232,-0.054999999701976776,-0.2029999941587448,-0.1889999955892563,-0.0949999988079071,0.07999999821186066,0.23000000417232513,0.4050000011920929,0.6039999723434448,0.7440000176429749,0.7870000004768372,0.734000027179718,0.5019999742507935,0.3070000112056732,0.1459999978542328,0.09700000286102295,0.07500000298023224,0.0820000022649765,0.052000001072883606,0.02199999988079071,-0.00800000037997961,-0.02800000086426735,-0.057999998331069946,-0.09700000286102295,-0.27000001072883606,-0.4009999930858612,-0.48899999260902405,-0.36000001430511475,-0.19599999487400055,0.004000000189989805,0.2590000033378601,0.4580000042915344,0.6000000238418579,0.6150000095367432,0.5040000081062317,0.26499998569488525,-0.0689999982714653,-0.2540000081062317,-